area,event_id,title,manual_validated_suggestion,manual_primary_contribution_type_suggestion,manual_method_family_seed,manual_benchmarks_seed,manual_datasets_seed,manual_metrics_seed,manual_artifact_status_suggestion,manual_result_character_seed,manual_fault_line_relevance_suggestion,manual_notes_seed,seed_status
"LLM Reasoning, Post-Training, and RLVR",62989,How much can language models memorize?,partial,analysis,Transformer / attention; memorization measurement,synthetic and real text sweeps,synthetic bitstrings; real text,memorization bits; bits per parameter; membership inference,linked_unchecked,scaling/measurement,caveat,Validate area broadly but correct subarea before using as diffusion-language-model evidence.,suggestion_only_not_manual_review
"Theory, Optimization, and Algorithms",66206,To Grok Grokking: Provable Grokking in Ridge Regression,yes,theory,ridge regression; gradient descent; weight decay,teacher-student regression; non-linear network simulations,synthetic regression,grokking time; generalization error,not_applicable,proof/theory,headline,Strong theory/program-attention example.,suggestion_only_not_manual_review
"LLM Reasoning, Post-Training, and RLVR",61998,The Flexibility Trap: Rethinking the Value of Arbitrary Order in Diffusion Language Models,yes,method,diffusion LMs; GRPO; autoregressive scaffold,reasoning and coding tasks,math/coding evaluations,pass@k; reasoning accuracy,linked_unchecked,empirical method,headline,"Clear LLM reasoning/post-training row, with caveat about task scope.",suggestion_only_not_manual_review
Systems and Efficient Foundation Models,65901,Neural Thickets: Diverse Task Experts Are Dense Around Pretrained Weights,partial,method,random weight perturbation; efficient adaptation; ensembling,LLM tasks and synthetic probes,math; writing; programming; chemistry; Countdown; synthetic signals,solution density; FLOP efficiency; accuracy,linked_unchecked,efficiency/optimization,caveat,Boundary row: efficient foundation-model adaptation more than systems infrastructure.,suggestion_only_not_manual_review
"LLM Reasoning, Post-Training, and RLVR",65332,Maximum Likelihood Reinforcement Learning,partial,method,maximum likelihood RL; sample-based objectives,sampling-based binary outcome tasks,navigation; code generation; math problem solving,pass@k; likelihood approximation; Pareto efficiency,linked_unchecked,objective/method,supporting,Boundary row spanning RL optimization and LLM/code/math generation.,suggestion_only_not_manual_review
"Agents, Code, and Tool Use",65206,PaperBanana: Automating Academic Illustration for AI Scientists,yes,system,multi-agent illustration generation workflow,PaperBananaBench and baseline comparisons,292 NeurIPS 2025 methodology-diagram cases,faithfulness; conciseness; readability; aesthetics,linked_unchecked,system/benchmark,headline,Strong agentic workflow example after repository/benchmark check.,suggestion_only_not_manual_review
"Safety, Governance, Privacy, and Society",60766,The Obfuscation Atlas: Mapping Where Honesty Emerges in RLVR with Deception Probes,yes,analysis,deception probes; RLVR; coding reward hacking,detector penalties and KL-regularized RL runs,coding reward-hacking environment,probe score; representation change; task return,linked_unchecked,safety empirical analysis,headline,Strong safety/program-attention example.,suggestion_only_not_manual_review
"LLM Reasoning, Post-Training, and RLVR",65886,Reinforcement Learning with Evolving Rubrics for Deep Research,yes,method,RL with evolving rubrics; search-augmented verification,deep-research benchmark suite,SQAv2; DeepResearchBench; ResearchQA; HealthBench,benchmark scores; average performance; query cost,linked_unchecked,empirical method/system,headline,Strong LLM post-training example after artifact and protocol checks.,suggestion_only_not_manual_review
