github_repo,github_url,live_status,http_status,qa_flags,suspicious_reason,paper_titles,sources,max_public_votes,alphaxiv_github_stars,live_stargazers_count,live_forks_count,open_issues_count,archived,disabled,fork,license_spdx,default_branch,created_at,updated_at,pushed_at,pushed_age_days,description,homepage,api_fetched_utc,api_error
sunrainyg/RandOpt,https://github.com/sunrainyg/RandOpt,live,200,,,Neural Thickets: Diverse Task Experts Are Dense Around Pretrained Weights,manual_validation_queue,365,0,628,68,0,false,false,false,,main,2026-02-18T17:00:45Z,2026-07-14T01:18:28Z,2026-07-10T04:47:06Z,4,"Official Codebase for ""Neural Thickets: Diverse Task Experts Are Dense Around Pretrained Weights"" (ICML 2026 Spotlight)",,2026-07-14T08:58:03.795954+00:00,
siyan-zhao/OPSD,https://github.com/siyan-zhao/OPSD,live,200,,,Self-Distilled Reasoner: On-Policy Self-Distillation for Large Language Models,manual_validation_queue,351,0,469,45,15,false,false,false,,main,2026-03-18T17:38:49Z,2026-07-14T08:21:49Z,2026-05-10T05:46:29Z,65,,,2026-07-14T08:58:04.337231+00:00,
SimonCao1207/LLM-Capacity,https://github.com/SimonCao1207/LLM-Capacity,live,200,,,How much can language models memorize?,manual_validation_queue,271,0,3,1,0,false,false,false,,main,2025-06-30T04:23:35Z,2026-07-13T14:19:45Z,2025-07-07T06:08:03Z,372,"Replication of paper ""How much do language models memorize?""",,2026-07-14T08:58:04.797176+00:00,
frankhlchi/SequentialDataVal,https://github.com/frankhlchi/SequentialDataVal,http_error:404,404,not_live_or_api_error,,Unifying and Optimizing Data Values for Selection via Sequential Decision-Making,manual_validation_queue,271,0,,,,,,,,,,,,,,,2026-07-14T08:58:05.179886+00:00,"{""message"":""Not Found"",""documentation_url"":""https://docs.github.com/rest/repos/repos#get-a-repository"",""status"":""404""}"
tajwarfahim/maxrl,https://github.com/tajwarfahim/maxrl,live,200,,,Maximum Likelihood Reinforcement Learning,manual_validation_queue,259,0,196,30,0,false,false,false,Apache-2.0,main,2026-02-02T23:20:47Z,2026-07-13T09:56:14Z,2026-05-28T03:20:21Z,47,"Official Implementation of ""Maximum Likelihood Reinforcement Learning (MaxRL)""",,2026-07-14T08:58:05.612072+00:00,
